{
  "id": "intercom-fin", "company": "Intercom", "product": "Fin AI Agent", "domain": "intercom.com", "pricing_url": "https://www.intercom.com/pricing",
  "classification": {"product_models": ["ai-agent", "vertical-ai"], "pricing_components": ["outcome-based", "usage-based", "seat-based", "enterprise-contract"], "charge_metrics": [], "customer_value_metrics": []},
  "observed": {"pricing_architecture": "Fin is priced at $0.99 per resolved customer outcome. It may be used with Intercom support plans or with an existing helpdesk, where Intercom states a minimum commitment applies.", "plans": [{"name": "Fin AI Agent", "price": 0.99, "currency": "USD", "per_unit": "resolved outcome", "public_price": true}, {"name": "Existing helpdesk deployment", "price_note": "No Intercom seat cost; official FAQ describes a minimum monthly commitment.", "public_price": true}, {"name": "Enterprise", "custom_pricing": true}], "free_access": {"available": false, "note": "Pricing is consumption-based; published deployment terms vary by support-stack choice."}, "enterprise": {"offered": true, "contact_sales": true}},
  "analysis": {"monetization_archetypes": ["outcome-pricing"], "expansion_vectors": [{"type": "increased-resolution-volume", "description": "Revenue scales with customer issues resolved by the agent.", "confidence": "verified"}], "monetization_summary": "Fin connects its consumption unit to a support outcome rather than a seat or model input."},
  "sources": [{"url": "https://www.intercom.com/pricing", "source_type": "official-pricing-page", "title": "Intercom pricing", "accessed_at": "2026-08-14", "supports": ["fin-price", "support-plans"], "confidence": "verified"}, {"url": "https://www.intercom.com/help/en/articles/7837535-fin-ai-agent-faqs", "source_type": "official-help-center", "title": "Fin AI Agent FAQs", "accessed_at": "2026-08-14", "supports": ["outcome-definition", "existing-helpdesk"], "confidence": "verified"}],
  "captured_at": "2026-08-14", "last_verified_at": "2026-08-14", "review_status": "verified"
}
