{
  "id": "groqcloud",
  "company": "Groq",
  "product": "GroqCloud",
  "domain": "groq.com",
  "pricing_url": "https://console.groq.com/docs/models",
  "classification": {
    "product_models": [
      "ai-infrastructure",
      "foundation-model-api"
    ],
    "pricing_components": [
      "enterprise-contract",
      "model-specific",
      "usage-based"
    ],
    "charge_metrics": [
      "input-token",
      "output-token"
    ],
    "customer_value_metrics": [
      "model-inference"
    ]
  },
  "observed": {
    "pricing_architecture": "GroqCloud documents production models with published per-token prices, while enterprise commercial engagement is available for larger deployments.",
    "plans": [
      {
        "name": "GroqCloud API",
        "price_note": "Published production-model token prices.",
        "billing_period": "usage",
        "public_price": true
      },
      {
        "name": "Enterprise",
        "custom_pricing": true
      }
    ],
    "free_access": {
      "available": true,
      "note": "Developer access is available; production billing is model-specific."
    },
    "enterprise": {
      "offered": true,
      "contact_sales": true
    }
  },
  "analysis": {
    "monetization_archetypes": [
      "consumption-monetization"
    ],
    "expansion_vectors": [
      {
        "type": "token-volume",
        "description": "Spend scales with input and output token volume.",
        "confidence": "verified"
      },
      {
        "type": "model-adoption",
        "description": "The price table varies by production model.",
        "confidence": "verified"
      }
    ],
    "monetization_summary": "GroqCloud commercializes high-speed inference through a familiar token meter, leaving the performance differentiation in the product rather than the billing unit."
  },
  "sources": [
    {
      "url": "https://console.groq.com/docs/models",
      "source_type": "official-pricing-docs",
      "title": "GroqCloud models and pricing",
      "accessed_at": "2026-08-14",
      "supports": [
        "pricing-model",
        "charge-metric",
        "free-tier"
      ],
      "confidence": "verified"
    }
  ],
  "captured_at": "2026-08-14",
  "last_verified_at": "2026-08-14",
  "review_status": "verified"
}
