{
  "id": "lovable", "company": "Lovable", "product": "Lovable", "domain": "lovable.dev", "pricing_url": "https://lovable.dev/pricing",
  "classification": {"product_models": ["developer-tool", "ai-agent"], "pricing_components": ["subscription", "credit-based", "included-credits", "usage-based", "freemium", "enterprise-contract"], "charge_metrics": ["credit"], "customer_value_metrics": ["developer-productivity", "coding-workflow"]},
  "observed": {"pricing_architecture": "Lovable uses a workspace-level shared credit pool rather than a per-seat model; credits fund building, cloud hosting, and in-app AI features. The public Free plan includes daily build credits plus cloud and AI-feature allowances. The captured source did not expose a full paid tier table.", "plans": [{"name": "Free", "price": 0, "currency": "USD", "billing_period": "month", "price_note": "Includes 5 daily build credits (up to 30/month), 20 Cloud credits, and 4 AI-feature credits in captured source.", "public_price": true}, {"name": "Paid workspace plans", "price_note": "Official pricing page presents shared-credit plans; capture did not record a complete paid price table.", "public_price": true}, {"name": "Enterprise", "custom_pricing": true}], "free_access": {"available": true, "note": "Free plan has published build, cloud, and AI-feature allowances."}, "enterprise": {"offered": true, "contact_sales": true}},
  "analysis": {"monetization_archetypes": ["shared-workspace-credits"], "expansion_vectors": [{"type": "shared-credit-consumption", "description": "One pool funds product building, hosting, and AI features across a workspace.", "confidence": "verified"}], "monetization_summary": "Lovable makes collaboration frictionless by pooling metered AI and cloud capacity at the workspace level."},
  "sources": [{"url": "https://lovable.dev/pricing", "source_type": "official-pricing-page", "title": "Lovable pricing", "accessed_at": "2026-08-14", "supports": ["free-allowances", "shared-credits", "billing-scope"], "confidence": "verified"}],
  "captured_at": "2026-08-14", "last_verified_at": "2026-08-14", "review_status": "verified"
}
