{
  "id": "jasper", "company": "Jasper", "product": "Jasper", "domain": "jasper.ai", "pricing_url": "https://www.jasper.ai/pricing",
  "classification": {"product_models": ["horizontal-ai-application", "ai-enabled-saas"], "pricing_components": ["subscription", "seat-based", "capability-based", "enterprise-contract"], "charge_metrics": ["user-seat"], "customer_value_metrics": []},
  "observed": {"pricing_architecture": "Jasper presents a per-seat Pro subscription and a custom Business offer. The public page describes additional brand, knowledge, audience, agent, and enterprise capabilities by tier.", "plans": [{"name": "Pro monthly", "price": 69, "currency": "USD", "billing_period": "month", "per_unit": "user-seat", "public_price": true}, {"name": "Pro annual", "price": 59, "currency": "USD", "billing_period": "month", "per_unit": "user-seat", "price_note": "Monthly equivalent when billed yearly.", "public_price": true}, {"name": "Business", "custom_pricing": true}], "free_access": {"available": false, "note": "No permanent free tier was recorded from the source capture."}, "enterprise": {"offered": true, "contact_sales": true}},
  "analysis": {"monetization_archetypes": ["seat-led-saas"], "expansion_vectors": [{"type": "more-seats", "description": "Public Pro pricing is per seat.", "confidence": "verified"}, {"type": "enterprise-upgrade", "description": "Business bundles advanced controls and agents through a custom offer.", "confidence": "verified"}], "monetization_summary": "Jasper monetizes an AI marketing workspace primarily through seats and enterprise capability packaging."},
  "sources": [{"url": "https://www.jasper.ai/pricing", "source_type": "official-pricing-page", "title": "Jasper pricing", "accessed_at": "2026-08-14", "supports": ["plans", "seat-pricing", "business-offer"], "confidence": "verified"}],
  "captured_at": "2026-08-14", "last_verified_at": "2026-08-14", "review_status": "verified"
}
