{
  "id": "claude-team", "company": "Anthropic", "product": "Claude Team", "domain": "claude.com", "pricing_url": "https://claude.com/pricing",
  "classification": {"product_models": ["ai-copilot", "horizontal-ai-application"], "pricing_components": ["subscription", "seat-based", "usage-based", "hybrid-seat-usage", "model-specific", "enterprise-contract"], "charge_metrics": ["user-seat", "model-usage"], "customer_value_metrics": []},
  "observed": {"pricing_architecture": "The Claude pricing page states a Team construction of $20 per seat/month plus usage billed at API rates. This record intentionally isolates the Team package from Anthropic's API product.", "plans": [{"name": "Team", "price": 20, "currency": "USD", "billing_period": "month", "per_unit": "user-seat", "price_note": "Plus usage billed at API rates.", "public_price": true}, {"name": "Enterprise", "custom_pricing": true}], "free_access": {"available": false, "note": "This package record covers the paid Team construction, not Claude's individual free offering."}, "enterprise": {"offered": true, "contact_sales": true}},
  "analysis": {"monetization_archetypes": ["hybrid-seat-usage"], "expansion_vectors": [{"type": "more-seats", "description": "The base Team fee is charged per seat.", "confidence": "verified"}, {"type": "model-usage", "description": "Team usage is billed at API rates according to the pricing source.", "confidence": "verified"}], "monetization_summary": "Claude Team explicitly combines organization access revenue with a variable model-consumption layer."},
  "sources": [{"url": "https://claude.com/pricing", "source_type": "official-pricing-page", "title": "Claude pricing", "accessed_at": "2026-08-14", "supports": ["team-seat-price", "api-rate-usage", "enterprise"], "confidence": "verified"}],
  "captured_at": "2026-08-14", "last_verified_at": "2026-08-14", "review_status": "verified"
}
