{
  "id": "notion-ai", "company": "Notion", "product": "Notion AI and Custom Agents", "domain": "notion.com", "pricing_url": "https://www.notion.com/pricing",
  "classification": {"product_models": ["ai-enabled-saas", "horizontal-ai-application", "ai-agent"], "pricing_components": ["subscription", "seat-based", "included-usage", "credit-based", "usage-based", "freemium", "enterprise-contract"], "charge_metrics": ["user-seat", "credit"], "customer_value_metrics": []},
  "observed": {"pricing_architecture": "Notion packages AI within workspace subscriptions and offers Custom Agents as a credit-priced layer after trial. The pricing page lists Free, Plus, Business, and custom Enterprise workspace tiers; core AI is included in Business and Enterprise.", "plans": [{"name": "Free", "price": 0, "currency": "USD", "billing_period": "month", "public_price": true}, {"name": "Plus", "price": 10, "currency": "USD", "billing_period": "month", "per_unit": "member", "public_price": true}, {"name": "Business", "price": 20, "currency": "USD", "billing_period": "month", "per_unit": "member", "public_price": true}, {"name": "Custom Agents", "price": 10, "currency": "USD", "per_unit": "1000 credits", "public_price": true}, {"name": "Enterprise", "custom_pricing": true}], "free_access": {"available": true, "note": "A Free workspace tier is published; AI access and trials vary by feature and plan."}, "enterprise": {"offered": true, "contact_sales": true}},
  "analysis": {"monetization_archetypes": ["bundled-ai", "credit-abstraction"], "expansion_vectors": [{"type": "workspace-upgrade", "description": "AI capability supports migration to higher workspace tiers.", "confidence": "verified"}, {"type": "agent-credit-consumption", "description": "Custom Agent credits create a usage expansion path.", "confidence": "verified"}], "monetization_summary": "Notion layers an agent credit pool onto an existing per-member workspace model."},
  "sources": [{"url": "https://www.notion.com/pricing", "source_type": "official-pricing-page", "title": "Notion pricing", "accessed_at": "2026-08-14", "supports": ["workspace-plans", "custom-agent-credits", "ai-inclusion"], "confidence": "verified"}, {"url": "https://www.notion.com/product/ai", "source_type": "official-product-page", "title": "Notion AI", "accessed_at": "2026-08-14", "supports": ["ai-product"], "confidence": "verified"}],
  "captured_at": "2026-08-14", "last_verified_at": "2026-08-14", "review_status": "verified"
}
