{
  "id": "cursor", "company": "Anysphere", "product": "Cursor", "domain": "cursor.com", "pricing_url": "https://cursor.com/pricing",
  "classification": {"product_models": ["ai-copilot", "developer-tool"], "pricing_components": ["subscription", "seat-based", "included-usage", "usage-based", "hybrid-seat-usage", "freemium", "enterprise-contract"], "charge_metrics": ["user-seat", "model-usage"], "customer_value_metrics": ["developer-productivity", "coding-workflow"]},
  "observed": {"pricing_architecture": "Free entry tier; individual subscriptions include model usage; teams are priced per user with enterprise custom pricing. Additional model usage can be purchased after included usage is consumed.", "plans": [{"name": "Hobby", "price": 0, "currency": "USD", "billing_period": "month", "public_price": true}, {"name": "Pro", "price": 20, "currency": "USD", "billing_period": "month", "public_price": true}, {"name": "Teams", "price": 40, "currency": "USD", "billing_period": "month", "per_unit": "user-seat", "public_price": true}, {"name": "Enterprise", "custom_pricing": true}], "free_access": {"available": true, "note": "Hobby tier has limited agent requests and tab completions."}, "enterprise": {"offered": true, "contact_sales": true}},
  "analysis": {"monetization_archetypes": ["hybrid-monetization", "credit-abstraction"], "expansion_vectors": [{"type": "more-seats", "description": "Team plan is charged per user.", "confidence": "verified"}, {"type": "increased-usage", "description": "On-demand usage continues after the included amount is consumed.", "confidence": "verified"}, {"type": "tier-upgrade", "description": "Higher individual tiers include more usage.", "confidence": "verified"}], "monetization_summary": "Cursor blends predictable seat revenue with model-usage expansion, keeping its customer-facing product subscription simple while preserving a metered backstop."},
  "sources": [{"url": "https://cursor.com/pricing", "source_type": "official-pricing-page", "title": "Cursor pricing", "accessed_at": "2026-08-14", "supports": ["plans", "pricing-model", "free-tier"], "confidence": "verified"}, {"url": "https://docs.cursor.com/account/pricing", "source_type": "official-pricing-docs", "title": "Cursor models and pricing", "accessed_at": "2026-08-14", "supports": ["included-usage", "overage", "charge-metric"], "confidence": "verified"}],
  "captured_at": "2026-08-14", "last_verified_at": "2026-08-14", "review_status": "verified"
}
