{
  "id": "elevenagents", "company": "ElevenLabs", "product": "ElevenAgents", "domain": "elevenlabs.io", "pricing_url": "https://help.elevenlabs.io/hc/en-us/articles/29298065878929-How-much-does-ElevenAgents-cost",
  "classification": {"product_models": ["ai-agent", "ai-infrastructure"], "pricing_components": ["usage-based", "subscription", "included-usage", "model-specific", "enterprise-contract"], "charge_metrics": ["audio-minute", "model-usage"], "customer_value_metrics": ["voice-workflow"]},
  "observed": {"pricing_architecture": "ElevenAgents charges agent-call usage on applicable subscriptions. Voice calls are duration-based, text-only calls are per message, and LLM charges are passed through separately; higher subscriptions include voice minutes and lower incremental rates.", "plans": [{"name": "Subscription-backed usage", "price_note": "Applicable subscription plans include varying voice-minute allowances and incremental rates.", "public_price": true}, {"name": "Enterprise", "custom_pricing": true}], "free_access": {"available": false, "note": "This product record captures agent usage layered on subscriptions; eligibility and included capacity vary by plan."}, "enterprise": {"offered": true, "contact_sales": true}},
  "analysis": {"monetization_archetypes": ["feature-level-consumption", "pass-through-model-cost"], "expansion_vectors": [{"type": "voice-minutes", "description": "Voice agent calls scale with duration.", "confidence": "verified"}, {"type": "conversation-volume", "description": "Text-only calls are priced per message.", "confidence": "verified"}], "monetization_summary": "ElevenAgents layers channel-specific usage and external model pass-through on top of the vendor's subscription structure."},
  "sources": [{"url": "https://help.elevenlabs.io/hc/en-us/articles/29298065878929-How-much-does-ElevenAgents-cost", "source_type": "official-help-center", "title": "How much does ElevenAgents cost?", "accessed_at": "2026-08-14", "supports": ["agent-call-pricing", "voice-duration", "text-message-pricing", "model-pass-through"], "confidence": "verified"}],
  "captured_at": "2026-08-14", "last_verified_at": "2026-08-14", "review_status": "verified"
}
