{
  "id": "cohere",
  "company": "Cohere",
  "product": "Cohere API",
  "domain": "cohere.com",
  "pricing_url": "https://cohere.com/pricing",
  "classification": {
    "product_models": [
      "ai-enabled-saas",
      "foundation-model-api"
    ],
    "pricing_components": [
      "enterprise-contract",
      "model-specific",
      "usage-based"
    ],
    "charge_metrics": [
      "input-token",
      "model-usage",
      "output-token"
    ],
    "customer_value_metrics": [
      "model-inference"
    ]
  },
  "observed": {
    "pricing_architecture": "The public pricing page provides API pricing by model and separates enterprise engagement from self-serve usage.",
    "plans": [
      {
        "name": "API",
        "price_note": "Published model-specific usage pricing.",
        "billing_period": "usage",
        "public_price": true
      },
      {
        "name": "Enterprise",
        "custom_pricing": true
      }
    ],
    "free_access": {
      "available": false,
      "note": "Free developer access, if available, is not represented as a production price plan here."
    },
    "enterprise": {
      "offered": true,
      "contact_sales": true
    }
  },
  "analysis": {
    "monetization_archetypes": [
      "consumption-monetization",
      "enterprise-contracting"
    ],
    "expansion_vectors": [
      {
        "type": "token-volume",
        "description": "API spend rises with model consumption.",
        "confidence": "verified"
      },
      {
        "type": "enterprise-adoption",
        "description": "Enterprise is positioned as a separate commercial path.",
        "confidence": "verified"
      }
    ],
    "monetization_summary": "Cohere combines self-serve model consumption with enterprise commercial packaging for private deployments and organizational use."
  },
  "sources": [
    {
      "url": "https://cohere.com/pricing",
      "source_type": "official-pricing-page",
      "title": "Cohere pricing",
      "accessed_at": "2026-08-14",
      "supports": [
        "pricing-model",
        "plans",
        "enterprise"
      ],
      "confidence": "verified"
    }
  ],
  "captured_at": "2026-08-14",
  "last_verified_at": "2026-08-14",
  "review_status": "verified"
}
