{
  "id": "github-copilot", "company": "GitHub", "product": "GitHub Copilot", "domain": "github.com", "pricing_url": "https://github.com/features/copilot/plans",
  "classification": {"product_models": ["ai-copilot", "developer-tool"], "pricing_components": ["subscription", "seat-based", "included-credits", "credit-based", "usage-based", "freemium"], "charge_metrics": ["user-seat", "ai-credit"], "customer_value_metrics": ["developer-productivity", "coding-workflow"]},
  "observed": {"pricing_architecture": "Individual subscriptions bundle a monthly AI-credit allowance; additional paid AI-credit usage can be governed by budget. Code completions remain unlimited on paid plans.", "plans": [{"name": "Free", "price": 0, "currency": "USD", "billing_period": "month", "public_price": true}, {"name": "Pro", "price": 10, "currency": "USD", "billing_period": "month", "per_unit": "user-seat", "included_credits_usd": 15, "public_price": true}, {"name": "Pro+", "price": 39, "currency": "USD", "billing_period": "month", "per_unit": "user-seat", "included_credits_usd": 70, "public_price": true}, {"name": "Max", "price": 100, "currency": "USD", "billing_period": "month", "per_unit": "user-seat", "included_credits_usd": 200, "public_price": true}], "free_access": {"available": true, "note": "Free plan has limited functionality."}, "enterprise": {"offered": true, "contact_sales": true}},
  "analysis": {"monetization_archetypes": ["hybrid-monetization", "credit-abstraction"], "expansion_vectors": [{"type": "more-seats", "description": "Licenses are assigned per user.", "confidence": "verified"}, {"type": "additional-credits", "description": "Usage beyond an included allowance can draw on paid AI credits.", "confidence": "verified"}], "monetization_summary": "A seat subscription is augmented with a money-denominated credit pool that makes variable model use controllable at the organization level."},
  "sources": [{"url": "https://github.com/features/copilot/plans", "source_type": "official-pricing-page", "title": "GitHub Copilot plans and pricing", "accessed_at": "2026-08-14", "supports": ["plans", "credits", "free-tier"], "confidence": "verified"}, {"url": "https://docs.github.com/en/billing/concepts/product-billing/github-copilot-billing", "source_type": "official-pricing-docs", "title": "GitHub Copilot billing", "accessed_at": "2026-08-14", "supports": ["charge-metric", "included-credits"], "confidence": "verified"}],
  "captured_at": "2026-08-14", "last_verified_at": "2026-08-14", "review_status": "verified"
}
