{
  "id": "intercom-copilot", "company": "Intercom", "product": "Intercom Copilot", "domain": "intercom.com", "pricing_url": "https://www.intercom.com/help/en/articles/9121384-copilot-included-and-unlimited-usage",
  "classification": {"product_models": ["ai-copilot", "vertical-ai"], "pricing_components": ["seat-based", "subscription", "included-usage", "freemium"], "charge_metrics": ["user-seat"], "customer_value_metrics": []},
  "observed": {"pricing_architecture": "Copilot is a teammate-facing seat add-on. Unlimited Copilot is $35 per teammate/month monthly or $29 per teammate/month annually; the source also describes included monthly Copilot and AI translation conversations per agent.", "plans": [{"name": "Included sample usage", "price": 0, "currency": "USD", "billing_period": "month", "per_unit": "agent", "price_note": "10 Copilot and 10 AI auto-translation conversations per agent in captured source.", "public_price": true}, {"name": "Unlimited Copilot monthly", "price": 35, "currency": "USD", "billing_period": "month", "per_unit": "teammate", "public_price": true}, {"name": "Unlimited Copilot annual", "price": 29, "currency": "USD", "billing_period": "month", "per_unit": "teammate", "price_note": "Monthly equivalent when billed annually.", "public_price": true}], "free_access": {"available": true, "note": "A limited monthly allowance is included per agent."}, "enterprise": {"offered": false}},
  "analysis": {"monetization_archetypes": ["seat-add-on"], "expansion_vectors": [{"type": "more-teammates", "description": "Unlimited Copilot pricing is per teammate.", "confidence": "verified"}], "monetization_summary": "Intercom monetizes agent-assist separately from Fin's outcome-priced customer automation."},
  "sources": [{"url": "https://www.intercom.com/help/en/articles/9121384-copilot-included-and-unlimited-usage", "source_type": "official-help-center", "title": "Copilot included and unlimited usage", "accessed_at": "2026-08-14", "supports": ["copilot-prices", "included-usage", "charge-metric"], "confidence": "verified"}],
  "captured_at": "2026-08-14", "last_verified_at": "2026-08-14", "review_status": "verified"
}
