{
  "id": "replit", "company": "Replit", "product": "Replit", "domain": "replit.com", "pricing_url": "https://replit.com/pricing",
  "classification": {"product_models": ["developer-tool", "ai-agent", "ai-enabled-service"], "pricing_components": ["subscription", "included-credits", "credit-based", "usage-based", "freemium", "enterprise-contract"], "charge_metrics": ["credit", "model-usage"], "customer_value_metrics": ["developer-productivity", "coding-workflow"]},
  "observed": {"pricing_architecture": "Replit offers a free entry tier, subscriptions with monthly platform credits, and usage-based spending across Agent and cloud services. Agent execution is effort-priced and may pass through third-party model cost at public API rates.", "plans": [{"name": "Starter", "price": 0, "currency": "USD", "billing_period": "month", "public_price": true}, {"name": "Core annual", "price": 20, "currency": "USD", "billing_period": "month", "price_note": "Annual price; includes $25 monthly platform credits in captured source.", "public_price": true}, {"name": "Pro annual", "price": 95, "currency": "USD", "billing_period": "month", "price_note": "Annual price; includes $100 monthly platform credits in captured source.", "public_price": true}, {"name": "Enterprise", "custom_pricing": true}], "free_access": {"available": true, "note": "Starter is listed as a free tier."}, "enterprise": {"offered": true, "contact_sales": true}},
  "analysis": {"monetization_archetypes": ["platform-credit-pool", "hybrid-subscription-usage"], "expansion_vectors": [{"type": "increased-platform-usage", "description": "Credits cover both AI Agent and cloud services, increasing account expansion surface.", "confidence": "verified"}, {"type": "tier-upgrade", "description": "Higher subscription tiers include larger monthly credit allowances.", "confidence": "verified"}], "monetization_summary": "Replit uses one credit pool to fund AI creation and the deployed application infrastructure it can generate."},
  "sources": [{"url": "https://replit.com/pricing", "source_type": "official-pricing-page", "title": "Replit pricing", "accessed_at": "2026-08-14", "supports": ["plans", "included-credits", "free-tier"], "confidence": "verified"}, {"url": "https://docs.replit.com/billing/ai-billing", "source_type": "official-docs", "title": "Replit AI billing", "accessed_at": "2026-08-14", "supports": ["agent-billing", "model-costs"], "confidence": "verified"}],
  "captured_at": "2026-08-14", "last_verified_at": "2026-08-14", "review_status": "verified"
}
