{
  "id": "bolt", "company": "StackBlitz", "product": "Bolt.new", "domain": "bolt.new", "pricing_url": "https://bolt.new/pricing",
  "classification": {"product_models": ["developer-tool", "ai-agent"], "pricing_components": ["subscription", "included-usage", "usage-based", "freemium", "seat-based", "enterprise-contract", "tiered"], "charge_metrics": ["input-token", "output-token", "user-seat"], "customer_value_metrics": ["developer-productivity", "coding-workflow"]},
  "observed": {"pricing_architecture": "Bolt offers a free allowance, token-based Pro capacity, per-member Teams pricing, and custom Enterprise. The source lists Free at 300k tokens/day and 1m/month; Pro starts at 10m tokens/month, and paid tokens roll over for one additional active month.", "plans": [{"name": "Free", "price": 0, "currency": "USD", "billing_period": "month", "price_note": "Includes published daily and monthly token allowances.", "public_price": true}, {"name": "Pro", "price": 25, "currency": "USD", "billing_period": "month", "price_note": "Starts at 10m tokens/month; selectable capacity may vary.", "public_price": true}, {"name": "Teams", "price": 30, "currency": "USD", "billing_period": "month", "per_unit": "member", "public_price": true}, {"name": "Enterprise", "custom_pricing": true}], "free_access": {"available": true, "note": "Free includes a daily and monthly token allowance."}, "enterprise": {"offered": true, "contact_sales": true}},
  "analysis": {"monetization_archetypes": ["token-allowance-subscription"], "expansion_vectors": [{"type": "higher-token-capacity", "description": "Pro capacity begins at a stated token amount and supports a usage ladder.", "confidence": "verified"}, {"type": "team-seats", "description": "Teams is priced per member.", "confidence": "verified"}], "monetization_summary": "Bolt pairs a developer-friendly token allowance with a team-seat offer and enterprise contract path."},
  "sources": [{"url": "https://bolt.new/pricing", "source_type": "official-pricing-page", "title": "Bolt.new pricing", "accessed_at": "2026-08-14", "supports": ["plans", "token-allowances", "rollover", "teams"], "confidence": "verified"}],
  "captured_at": "2026-08-14", "last_verified_at": "2026-08-14", "review_status": "verified"
}
