{
  "id": "descript", "company": "Descript", "product": "Descript", "domain": "descript.com", "pricing_url": "https://www.descript.com/pricing",
  "classification": {"product_models": ["ai-enabled-saas", "horizontal-ai-application"], "pricing_components": ["subscription", "seat-based", "included-credits", "credit-based", "freemium", "enterprise-contract"], "charge_metrics": ["user-seat", "credit"], "customer_value_metrics": []},
  "observed": {"pricing_architecture": "Descript combines per-editor subscriptions with plan allowances for media hours and AI credits; paid plans can add top-ups and Enterprise is custom.", "plans": [{"name": "Free", "price": 0, "currency": "USD", "billing_period": "month", "public_price": true}, {"name": "Hobbyist annual", "price": 16, "currency": "USD", "billing_period": "month", "per_unit": "editor", "price_note": "Annual-equivalent monthly price; includes 10 media hours and 400 AI credits in captured source.", "public_price": true}, {"name": "Creator annual", "price": 24, "currency": "USD", "billing_period": "month", "per_unit": "editor", "price_note": "Annual-equivalent monthly price; includes 30 media hours and 800 AI credits in captured source.", "public_price": true}, {"name": "Business annual", "price": 50, "currency": "USD", "billing_period": "month", "per_unit": "editor", "price_note": "Annual-equivalent monthly price; includes 40 media hours and 1,500 AI credits in captured source.", "public_price": true}, {"name": "Enterprise", "custom_pricing": true}], "free_access": {"available": true, "note": "Official pricing page lists a Free plan."}, "enterprise": {"offered": true, "contact_sales": true}},
  "analysis": {"monetization_archetypes": ["allowance-led-subscription", "credit-abstraction"], "expansion_vectors": [{"type": "tier-upgrade", "description": "Higher tiers package additional media and AI capacity.", "confidence": "verified"}, {"type": "top-up", "description": "Paid plans support additional capacity purchases.", "confidence": "verified"}], "monetization_summary": "Descript wraps AI-intensive editing features in a creator-friendly seat subscription with capacity allowances."},
  "sources": [{"url": "https://www.descript.com/pricing", "source_type": "official-pricing-page", "title": "Descript pricing", "accessed_at": "2026-08-14", "supports": ["plans", "ai-credits", "media-hours", "top-ups"], "confidence": "verified"}],
  "captured_at": "2026-08-14", "last_verified_at": "2026-08-14", "review_status": "verified"
}
